{
  "binding_version": "vnext.capture_binding/1.0.0",
  "binding_id": "cap-finalN5-formal_no_ui",
  "stage": "art_complete",
  "created_at": "2026-10-26T01:26:12.318602+00:00",
  "backend": {
    "name": "cocos-creator-web-desktop",
    "version": "3.8.8"
  },
  "viewport": {
    "browser_width": 1280,
    "browser_height": 720,
    "scroll_x": 0,
    "scroll_y": 0,
    "device_pixel_ratio": 1
  },
  "canvas": {
    "selector": "#GameCanvas",
    "css_rect": {
      "x": 5,
      "y": 5,
      "width": 1280,
      "height": 720
    },
    "backing_width": 1280,
    "backing_height": 720,
    "capture_method": "element_screenshot",
    "page_screenshot": false
  },
  "camera": {
    "node": "Main Camera",
    "position": [
      -2.5,
      11.5,
      -14.6
    ],
    "rotation": [
      -36.276619358317014,
      180,
      0
    ],
    "fov": 37.5,
    "clip_time": null
  },
  "sources": [
    {
      "role": "map_blend",
      "path": "art/candidates/candidate_n5/source/layout/MAP001_courtyard.blend",
      "sha256": "a323b65b7b2270bd88d01e290be7c0351b2ebd3aaefaaeed187c9b4ca534878f"
    },
    {
      "role": "tree_blend",
      "path": "art/candidates/candidate_n5/source/environment/ENV006_autumn_tree.blend",
      "sha256": "f2d19cf6b24ce492768ecaef1f1806ea9126b817dfa1f5466f1cfde817249eb1"
    },
    {
      "role": "map_script",
      "path": "tools/blender_n5/build_map001.py",
      "sha256": "3d24b4d25e45d8f14e0f91ed88f42aeec86fd2c2ed82f96d806db74d9578aef7"
    },
    {
      "role": "tree_script",
      "path": "tools/blender_n5/build_env_courtyard.py",
      "sha256": "fc5ba646ff97d654e02730e3d82735d1bfeffd22e723effe2df41e0786aa53bf"
    },
    {
      "role": "engine_bootstrap",
      "path": "demo_n5/assets/scripts/CourtyardBootstrap.ts",
      "sha256": "e0f4b4402ae48bfc15d4a40f372c6e24a6a861e9b365dfab73c11411c666affd"
    }
  ],
  "exports": [
    {
      "role": "map_glb",
      "path": "art/candidates/candidate_n5/source/layout/MAP001_courtyard.glb",
      "sha256": "2ed1ab372a32b46901132a3ba2db06eeb07b979e9be2efc6fa8b87fbda9310d6"
    },
    {
      "role": "engine_glb",
      "path": "demo_n5/assets/resources/models/MAP001_courtyard.glb",
      "sha256": "2ed1ab372a32b46901132a3ba2db06eeb07b979e9be2efc6fa8b87fbda9310d6"
    }
  ],
  "shared_inputs": [
    {
      "role": "texture",
      "path": "art/candidates/candidate_n5/source/textures/tex_stone_tiles.png",
      "sha256": "9bef1df46f0a10dd8583a54edacb312f6806f38f79a75385ae93a0890bdcd3ea",
      "scope": [
        "MAP001"
      ]
    },
    {
      "role": "texture",
      "path": "art/candidates/candidate_n5/source/textures/tex_wood_grain.png",
      "sha256": "edd97f8ec9843e59fd2ab6fa5858b589af0987a028c01b8d4ed4c9bf9ef54c58",
      "scope": [
        "MAP001"
      ]
    },
    {
      "role": "texture",
      "path": "art/candidates/candidate_n5/source/textures/tex_metal_brushed.png",
      "sha256": "e3bba2c74bad44ba34e897e3e6fbda7d6e05fed67f98d6f0b3243c19240ee2bd",
      "scope": [
        "MAP001"
      ]
    },
    {
      "role": "texture",
      "path": "art/candidates/candidate_n5/source/textures/tex_soil_noise.png",
      "sha256": "71811cea5494328f85b3fc4d1be94a9f57e7f8c96387eef09e9c1e139f636b2e",
      "scope": [
        "MAP001"
      ]
    },
    {
      "role": "texture",
      "path": "art/candidates/candidate_n5/source/textures/tex_bark.png",
      "sha256": "b72f5f75982d1886bcd7b828a3d857f6de894dc138078360cb28cf3c047b07d6",
      "scope": [
        "MAP001"
      ]
    },
    {
      "role": "texture",
      "path": "art/candidates/candidate_n5/source/textures/tex_leaf_detail.png",
      "sha256": "2f056eb4c032e7f91a54fe0495881584d3639e7ed4ad9f76ea1d73723b0427de",
      "scope": [
        "MAP001"
      ]
    }
  ],
  "build": {
    "build_id": "cocos-web-desktop-cocos_build_20261026_090949",
    "log_path": "delivery/next_cycle/n5/performance/logs/cocos.n5b-02.20261026T010857Z.log",
    "log_sha256": "089925b6fc7a178075bd6d36da1f0fd653ab3e75fa24b140dc2901a5554d1c54",
    "result": "success"
  },
  "output": {
    "path": "delivery/next_cycle/n5/T3/game_finalN5_formal_no_ui.png",
    "sha256": "d63663c0515198f61563575f67b91e246c5d32d85da015f3dc2c2e87bce40cef",
    "width": 1280,
    "height": 720
  },
  "notes": [
    "FOV 37.5 composition calibration; Spine source scale unchanged.",
    "Cocos 3.8.8 exit 36 accepted only by the versioned gate rule with output present."
  ]
}
